"37",564,817,1373,1356,693,633,1048,1819,1820,1575,1710,1478,1446,1220,1556,571,1115,1087,"g39438","Q2EJA0",1.24e-59,"YAP1_RAT","reviewed","Transcriptional coactivator YAP1 (Yes-associated protein 1) (Protein yorkie homolog) (Yes-associated protein YAP65 homolog)","Yap1 Yap Yap65","Rattus norvegicus (Rat)",469,"bud elongation involved in lung branching [GO:0060449]; cardiac muscle tissue regeneration [GO:0061026]; cell morphogenesis [GO:0000902]; cell population proliferation [GO:0008283]; cellular response to DNA damage stimulus [GO:0006974]; cellular response to gamma radiation [GO:0071480]; cellular response to retinoic acid [GO:0071300]; contact inhibition [GO:0060242]; DNA damage induced protein phosphorylation [GO:0006975]; embryonic heart tube morphogenesis [GO:0003143]; heart process [GO:0003015]; hippo signaling [GO:0035329]; keratinocyte differentiation [GO:0030216]; lateral mesoderm development [GO:0048368]; lung epithelial cell differentiation [GO:0060487]; negative regulation of epithelial cell apoptotic process [GO:1904036]; negative regulation of epithelial cell differentiation [GO:0030857]; negative regulation of extrinsic apoptotic signaling pathway [GO:2001237]; negative regulation of gene expression [GO:0010629]; negative regulation of stem cell differentiation [GO:2000737]; notochord development [GO:0030903]; paraxial mesoderm development [GO:0048339]; positive regulation of canonical Wnt signaling pathway [GO:0090263]; positive regulation of cardiac muscle cell proliferation [GO:0060045]; positive regulation of cell population proliferation [GO:0008284]; positive regulation of epithelial cell proliferation [GO:0050679]; positive regulation of intracellular estrogen receptor signaling pathway [GO:0033148]; positive regulation of organ growth [GO:0046622]; positive regulation of stem cell population maintenance [GO:1902459]; positive regulation of transcription, DNA-templated [GO:0045893]; positive regulation of transcription by RNA polymerase II [GO:0045944]; progesterone receptor signaling pathway [GO:0050847]; protein-containing complex assembly [GO:0065003]; regulation of canonical Wnt signaling pathway [GO:0060828]; regulation of cell population proliferation [GO:0042127]; regulation of gene expression [GO:0010468]; regulation of keratinocyte proliferation [GO:0010837]; regulation of metanephric nephron tubule epithelial cell differentiation [GO:0072307]; regulation of neurogenesis [GO:0050767]; regulation of stem cell proliferation [GO:0072091]; response to progesterone [GO:0032570]; somatic stem cell population maintenance [GO:0035019]; tissue homeostasis [GO:0001894]; vasculogenesis [GO:0001570]","cytoplasm [GO:0005737]; cytosol [GO:0005829]; membrane [GO:0016020]; nucleoplasm [GO:0005654]; nucleus [GO:0005634]; TEAD-1-YAP complex [GO:0071148]; TEAD-2-YAP complex [GO:0071149]; transcription factor complex [GO:0005667]","cytoplasm [GO:0005737]; cytosol [GO:0005829]; membrane [GO:0016020]; nucleoplasm [GO:0005654]; nucleus [GO:0005634]; TEAD-1-YAP complex [GO:0071148]; TEAD-2-YAP complex [GO:0071149]; transcription factor complex [GO:0005667]; activating transcription factor binding [GO:0033613]; chromatin binding [GO:0003682]; proline-rich region binding [GO:0070064]; protein C-terminus binding [GO:0008022]; protein heterodimerization activity [GO:0046982]; RNA polymerase II cis-regulatory region sequence-specific DNA binding [GO:0000978]; transcription coactivator activity [GO:0003713]; transcription corepressor activity [GO:0003714]; transcription factor binding [GO:0008134]; transcription regulatory region DNA binding [GO:0044212]; bud elongation involved in lung branching [GO:0060449]; cardiac muscle tissue regeneration [GO:0061026]; cell morphogenesis [GO:0000902]; cell population proliferation [GO:0008283]; cellular response to DNA damage stimulus [GO:0006974]; cellular response to gamma radiation [GO:0071480]; cellular response to retinoic acid [GO:0071300]; contact inhibition [GO:0060242]; DNA damage induced protein phosphorylation [GO:0006975]; embryonic heart tube morphogenesis [GO:0003143]; heart process [GO:0003015]; hippo signaling [GO:0035329]; keratinocyte differentiation [GO:0030216]; lateral mesoderm development [GO:0048368]; lung epithelial cell differentiation [GO:0060487]; negative regulation of epithelial cell apoptotic process [GO:1904036]; negative regulation of epithelial cell differentiation [GO:0030857]; negative regulation of extrinsic apoptotic signaling pathway [GO:2001237]; negative regulation of gene expression [GO:0010629]; negative regulation of stem cell differentiation [GO:2000737]; notochord development [GO:0030903]; paraxial mesoderm development [GO:0048339]; positive regulation of canonical Wnt signaling pathway [GO:0090263]; positive regulation of cardiac muscle cell proliferation [GO:0060045]; positive regulation of cell population proliferation [GO:0008284]; positive regulation of epithelial cell proliferation [GO:0050679]; positive regulation of intracellular estrogen receptor signaling pathway [GO:0033148]; positive regulation of organ growth [GO:0046622]; positive regulation of stem cell population maintenance [GO:1902459]; positive regulation of transcription by RNA polymerase II [GO:0045944]; positive regulation of transcription, DNA-templated [GO:0045893]; progesterone receptor signaling pathway [GO:0050847]; protein-containing complex assembly [GO:0065003]; regulation of canonical Wnt signaling pathway [GO:0060828]; regulation of cell population proliferation [GO:0042127]; regulation of gene expression [GO:0010468]; regulation of keratinocyte proliferation [GO:0010837]; regulation of metanephric nephron tubule epithelial cell differentiation [GO:0072307]; regulation of neurogenesis [GO:0050767]; regulation of stem cell proliferation [GO:0072091]; response to progesterone [GO:0032570]; somatic stem cell population maintenance [GO:0035019]; tissue homeostasis [GO:0001894]; vasculogenesis [GO:0001570]","activating transcription factor binding [GO:0033613]; chromatin binding [GO:0003682]; proline-rich region binding [GO:0070064]; protein C-terminus binding [GO:0008022]; protein heterodimerization activity [GO:0046982]; RNA polymerase II cis-regulatory region sequence-specific DNA binding [GO:0000978]; transcription coactivator activity [GO:0003713]; transcription corepressor activity [GO:0003714]; transcription factor binding [GO:0008134]; transcription regulatory region DNA binding [GO:0044212]","GO:0000902; GO:0000978; GO:0001570; GO:0001894; GO:0003015; GO:0003143; GO:0003682; GO:0003713; GO:0003714; GO:0005634; GO:0005654; GO:0005667; GO:0005737; GO:0005829; GO:0006974; GO:0006975; GO:0008022; GO:0008134; GO:0008283; GO:0008284; GO:0010468; GO:0010629; GO:0010837; GO:0016020; GO:0030216; GO:0030857; GO:0030903; GO:0032570; GO:0033148; GO:0033613; GO:0035019; GO:0035329; GO:0042127; GO:0044212; GO:0045893; GO:0045944; GO:0046622; GO:0046982; GO:0048339; GO:0048368; GO:0050679; GO:0050767; GO:0050847; GO:0060045; GO:0060242; GO:0060449; GO:0060487; GO:0060828; GO:0061026; GO:0065003; GO:0070064; GO:0071148; GO:0071149; GO:0071300; GO:0071480; GO:0072091; GO:0072307; GO:0090263; GO:1902459; GO:1904036; GO:2000737; GO:2001237","K16687;","rno:363014;"
"38",6,7,16,14,12,6,0,13,19,0,0,13,15,7,12,0,13,13,"g39753","Q14CM0",2.2e-18,"FRPD4_HUMAN","reviewed","FERM and PDZ domain-containing protein 4 (PDZ domain-containing protein 10) (PSD-95-interacting regulator of spine morphogenesis) (Preso)","FRMPD4 KIAA0316 PDZD10 PDZK10","Homo sapiens (Human)",1322,"positive regulation of synapse structural plasticity [GO:0051835]; postsynaptic actin cytoskeleton organization [GO:0098974]","cell junction [GO:0030054]; cytoskeleton [GO:0005856]; dendritic spine [GO:0043197]; glutamatergic synapse [GO:0098978]; postsynaptic density [GO:0014069]; protein-containing complex [GO:0032991]","cell junction [GO:0030054]; cytoskeleton [GO:0005856]; dendritic spine [GO:0043197]; glutamatergic synapse [GO:0098978]; postsynaptic density [GO:0014069]; protein-containing complex [GO:0032991]; phosphatidylinositol-4,5-bisphosphate binding [GO:0005546]; positive regulation of synapse structural plasticity [GO:0051835]; postsynaptic actin cytoskeleton organization [GO:0098974]","phosphatidylinositol-4,5-bisphosphate binding [GO:0005546]","GO:0005546; GO:0005856; GO:0014069; GO:0030054; GO:0032991; GO:0043197; GO:0051835; GO:0098974; GO:0098978","","hsa:9758;"
"39",45,83,195,47,29,25,539,197,107,39,509,62,295,107,86,58,167,69,"g40284","Q9HAR2",5.94e-74,"AGRL3_HUMAN","reviewed","Adhesion G protein-coupled receptor L3 (Calcium-independent alpha-latrotoxin receptor 3) (CIRL-3) (Latrophilin-3) (Lectomedin-3)","ADGRL3 KIAA0768 LEC3 LPHN3","Homo sapiens (Human)",1447,"adenylate cyclase-activating G protein-coupled receptor signaling pathway [GO:0007189]; brain development [GO:0007420]; cell-cell adhesion via plasma-membrane adhesion molecules [GO:0098742]; cell surface receptor signaling pathway [GO:0007166]; G protein-coupled receptor signaling pathway [GO:0007186]; locomotion involved in locomotory behavior [GO:0031987]; neuron migration [GO:0001764]; positive regulation of synapse assembly [GO:0051965]; response to cocaine [GO:0042220]; synapse assembly [GO:0007416]","axon [GO:0030424]; cell-cell junction [GO:0005911]; glutamatergic synapse [GO:0098978]; integral component of membrane [GO:0016021]; integral component of plasma membrane [GO:0005887]","axon [GO:0030424]; cell-cell junction [GO:0005911]; glutamatergic synapse [GO:0098978]; integral component of membrane [GO:0016021]; integral component of plasma membrane [GO:0005887]; calcium ion binding [GO:0005509]; carbohydrate binding [GO:0030246]; G protein-coupled receptor activity [GO:0004930]; adenylate cyclase-activating G protein-coupled receptor signaling pathway [GO:0007189]; brain development [GO:0007420]; cell surface receptor signaling pathway [GO:0007166]; cell-cell adhesion via plasma-membrane adhesion molecules [GO:0098742]; G protein-coupled receptor signaling pathway [GO:0007186]; locomotion involved in locomotory behavior [GO:0031987]; neuron migration [GO:0001764]; positive regulation of synapse assembly [GO:0051965]; response to cocaine [GO:0042220]; synapse assembly [GO:0007416]","calcium ion binding [GO:0005509]; carbohydrate binding [GO:0030246]; G protein-coupled receptor activity [GO:0004930]","GO:0001764; GO:0004930; GO:0005509; GO:0005887; GO:0005911; GO:0007166; GO:0007186; GO:0007189; GO:0007416; GO:0007420; GO:0016021; GO:0030246; GO:0030424; GO:0031987; GO:0042220; GO:0051965; GO:0098742; GO:0098978","K04594;","hsa:23284;"
"40",185,241,312,221,177,178,162,324,290,204,313,230,324,249,453,159,362,366,"g41210","Q8WUB8",2.43e-114,"PHF10_HUMAN","reviewed","PHD finger protein 10 (BRG1-associated factor 45a) (BAF45a) (XAP135)","PHF10 BAF45A","Homo sapiens (Human)",498,"negative regulation of transcription, DNA-templated [GO:0045892]; nervous system development [GO:0007399]; positive regulation of transcription by RNA polymerase II [GO:0045944]","histone acetyltransferase complex [GO:0000123]; npBAF complex [GO:0071564]; nuclear chromatin [GO:0000790]; nucleoplasm [GO:0005654]; nucleus [GO:0005634]","histone acetyltransferase complex [GO:0000123]; npBAF complex [GO:0071564]; nuclear chromatin [GO:0000790]; nucleoplasm [GO:0005654]; nucleus [GO:0005634]; histone acetyltransferase activity [GO:0004402]; histone binding [GO:0042393]; metal ion binding [GO:0046872]; negative regulation of transcription, DNA-templated [GO:0045892]; nervous system development [GO:0007399]; positive regulation of transcription by RNA polymerase II [GO:0045944]","histone acetyltransferase activity [GO:0004402]; histone binding [GO:0042393]; metal ion binding [GO:0046872]","GO:0000123; GO:0000790; GO:0004402; GO:0005634; GO:0005654; GO:0007399; GO:0042393; GO:0045892; GO:0045944; GO:0046872; GO:0071564","K22197;","hsa:55274;"
"41",104,173,179,143,82,89,49,159,178,111,114,121,55,138,177,33,92,189,"g41478","Q5FYB1",0,"ARSI_HUMAN","reviewed","Arylsulfatase I (ASI) (EC 3.1.6.-)","ARSI","Homo sapiens (Human)",569,"","endoplasmic reticulum lumen [GO:0005788]; extracellular region [GO:0005576]","endoplasmic reticulum lumen [GO:0005788]; extracellular region [GO:0005576]; arylsulfatase activity [GO:0004065]; metal ion binding [GO:0046872]","arylsulfatase activity [GO:0004065]; metal ion binding [GO:0046872]","GO:0004065; GO:0005576; GO:0005788; GO:0046872","K12375;","hsa:340075;"
"42",109,100,104,216,114,177,10,61,134,57,51,74,7,45,34,4,34,24,"g41788",NA,NA,NA,NA,NA,NA,NA,NA,NA,NA,NA,NA,NA,NA,NA
