"","T4.1","T4.10","T4.16","T4.17","T4.6","T4.8","T5.1","T5.10","T5.16","T5.17","T5.6","T5.8","T7.1","T7.10","T7.16","T7.17","T7.6","T7.8","gene","Uniprot","eval","Prot.ID","Rev","Prot.Name.Long","Prot.Name.Short","Taxa","Num","GO1","GO2","GO3","GO4","GO.IDs","KEGG","KEGG.Path"
"1",317,499,673,593,327,287,482,602,725,488,733,447,879,794,962,437,775,725,"g22366","P45953",0,"ACADV_RAT","reviewed","Very long-chain specific acyl-CoA dehydrogenase, mitochondrial (VLCAD) (EC 1.3.8.9)","Acadvl Vlcad","Rattus norvegicus (Rat)",655,"epithelial cell differentiation [GO:0030855]; fatty acid beta-oxidation [GO:0006635]; fatty acid beta-oxidation using acyl-CoA dehydrogenase [GO:0033539]; fatty acid catabolic process [GO:0009062]; negative regulation of fatty acid biosynthetic process [GO:0045717]; negative regulation of fatty acid oxidation [GO:0046322]; regulation of cholesterol metabolic process [GO:0090181]; response to cold [GO:0009409]; temperature homeostasis [GO:0001659]","mitochondrial inner membrane [GO:0005743]; mitochondrial membrane [GO:0031966]; mitochondrial nucleoid [GO:0042645]; mitochondrion [GO:0005739]","mitochondrial inner membrane [GO:0005743]; mitochondrial membrane [GO:0031966]; mitochondrial nucleoid [GO:0042645]; mitochondrion [GO:0005739]; acyl-CoA dehydrogenase activity [GO:0003995]; fatty-acyl-CoA binding [GO:0000062]; flavin adenine dinucleotide binding [GO:0050660]; long-chain-acyl-CoA dehydrogenase activity [GO:0004466]; very-long-chain-acyl-CoA dehydrogenase activity [GO:0017099]; epithelial cell differentiation [GO:0030855]; fatty acid beta-oxidation [GO:0006635]; fatty acid beta-oxidation using acyl-CoA dehydrogenase [GO:0033539]; fatty acid catabolic process [GO:0009062]; negative regulation of fatty acid biosynthetic process [GO:0045717]; negative regulation of fatty acid oxidation [GO:0046322]; regulation of cholesterol metabolic process [GO:0090181]; response to cold [GO:0009409]; temperature homeostasis [GO:0001659]","acyl-CoA dehydrogenase activity [GO:0003995]; fatty-acyl-CoA binding [GO:0000062]; flavin adenine dinucleotide binding [GO:0050660]; long-chain-acyl-CoA dehydrogenase activity [GO:0004466]; very-long-chain-acyl-CoA dehydrogenase activity [GO:0017099]","GO:0000062; GO:0001659; GO:0003995; GO:0004466; GO:0005739; GO:0005743; GO:0006635; GO:0009062; GO:0009409; GO:0017099; GO:0030855; GO:0031966; GO:0033539; GO:0042645; GO:0045717; GO:0046322; GO:0050660; GO:0090181","K09479;","rno:25363;"
"2",128,182,196,186,99,119,159,213,288,194,175,239,249,310,314,156,272,281,"g22542","P02594",2.47e-64,"CALM_ELEEL","reviewed","Calmodulin (CaM)","calm","Electrophorus electricus (Electric eel) (Gymnotus electricus)",149,"calcium-mediated signaling [GO:0019722]","","calcium ion binding [GO:0005509]; calcium-mediated signaling [GO:0019722]","calcium ion binding [GO:0005509]","GO:0005509; GO:0019722","",""
"3",108,35,61,87,91,29,74,70,69,111,148,55,122,54,80,42,167,39,"g22955","Q09694",1.02e-118,"LYS1_SCHPO","reviewed","Saccharopine dehydrogenase [NAD(+), L-lysine-forming] (SDH) (EC 1.5.1.7) (Lysine--2-oxoglutarate reductase)","lys3 SPAC227.18 SPAC2F7.01","Schizosaccharomyces pombe (strain 972 / ATCC 24843) (Fission yeast)",368,"lysine biosynthetic process [GO:0009085]; lysine biosynthetic process via aminoadipic acid [GO:0019878]","cytoplasm [GO:0005737]","cytoplasm [GO:0005737]; saccharopine dehydrogenase (NAD+, L-lysine-forming) activity [GO:0004754]; lysine biosynthetic process [GO:0009085]; lysine biosynthetic process via aminoadipic acid [GO:0019878]","saccharopine dehydrogenase (NAD+, L-lysine-forming) activity [GO:0004754]","GO:0004754; GO:0005737; GO:0009085; GO:0019878","K00290;","spo:SPAC227.18;"
"4",285,572,1289,726,447,289,170,1754,1637,485,919,745,7208,2187,4971,367,1250,3344,"g23756","Q86WI1",0,"PKHL1_HUMAN","reviewed","Fibrocystin-L (Polycystic kidney and hepatic disease 1-like protein 1) (PKHD1-like protein 1)","PKHD1L1","Homo sapiens (Human)",4243,"immune response [GO:0006955]","cilium [GO:0005929]; cytosol [GO:0005829]; extracellular space [GO:0005615]; integral component of membrane [GO:0016021]","cilium [GO:0005929]; cytosol [GO:0005829]; extracellular space [GO:0005615]; integral component of membrane [GO:0016021]; signaling receptor activity [GO:0038023]; immune response [GO:0006955]","signaling receptor activity [GO:0038023]","GO:0005615; GO:0005829; GO:0005929; GO:0006955; GO:0016021; GO:0038023","","hsa:93035;"
"5",40,56,95,59,32,13,16,75,114,41,46,52,10,57,76,12,13,50,"g24187","Q99056",6.71e-52,"LAC5_TRAVI","reviewed","Laccase-5 (EC 1.10.3.2) (Benzenediol:oxygen oxidoreductase 5) (Diphenol oxidase 5) (Urishiol oxidase 5)","LCC5","Trametes villosa (White-rot fungus)",527,"lignin catabolic process [GO:0046274]","extracellular region [GO:0005576]","extracellular region [GO:0005576]; copper ion binding [GO:0005507]; hydroquinone:oxygen oxidoreductase activity [GO:0052716]; lignin catabolic process [GO:0046274]","copper ion binding [GO:0005507]; hydroquinone:oxygen oxidoreductase activity [GO:0052716]","GO:0005507; GO:0005576; GO:0046274; GO:0052716","",""
"6",388,351,429,527,404,217,285,413,317,318,426,188,360,252,336,276,478,175,"g25232","Q921L8",0,"GLT11_MOUSE","reviewed","Polypeptide N-acetylgalactosaminyltransferase 11 (EC 2.4.1.41) (Polypeptide GalNAc transferase 11) (GalNAc-T11) (pp-GaNTase 11) (Protein-UDP acetylgalactosaminyltransferase 11) (UDP-GalNAc:polypeptide N-acetylgalactosaminyltransferase 11)","Galnt11","Mus musculus (Mouse)",608,"cilium assembly [GO:0060271]; determination of left/right symmetry [GO:0007368]; Notch receptor processing [GO:0007220]; Notch signaling involved in heart development [GO:0061314]; protein O-linked glycosylation via threonine [GO:0018243]; regulation of Notch signaling pathway [GO:0008593]","Golgi apparatus [GO:0005794]; Golgi membrane [GO:0000139]; integral component of membrane [GO:0016021]","Golgi apparatus [GO:0005794]; Golgi membrane [GO:0000139]; integral component of membrane [GO:0016021]; carbohydrate binding [GO:0030246]; metal ion binding [GO:0046872]; Notch binding [GO:0005112]; polypeptide N-acetylgalactosaminyltransferase activity [GO:0004653]; cilium assembly [GO:0060271]; determination of left/right symmetry [GO:0007368]; Notch receptor processing [GO:0007220]; Notch signaling involved in heart development [GO:0061314]; protein O-linked glycosylation via threonine [GO:0018243]; regulation of Notch signaling pathway [GO:0008593]","carbohydrate binding [GO:0030246]; metal ion binding [GO:0046872]; Notch binding [GO:0005112]; polypeptide N-acetylgalactosaminyltransferase activity [GO:0004653]","GO:0000139; GO:0004653; GO:0005112; GO:0005794; GO:0007220; GO:0007368; GO:0008593; GO:0016021; GO:0018243; GO:0030246; GO:0046872; GO:0060271; GO:0061314","K00710;","mmu:231050;"
"7",467,887,1089,646,555,808,44,595,414,546,428,590,91,88,240,99,120,236,"g25294","P57788",2.81e-40,"MOT4_CHICK","reviewed","Monocarboxylate transporter 4 (MCT 4) (Solute carrier family 16 member 3)","SLC16A3 MCT4","Gallus gallus (Chicken)",473,"monocarboxylic acid transport [GO:0015718]","integral component of membrane [GO:0016021]; integral component of plasma membrane [GO:0005887]","integral component of membrane [GO:0016021]; integral component of plasma membrane [GO:0005887]; lactate transmembrane transporter activity [GO:0015129]; monocarboxylic acid transmembrane transporter activity [GO:0008028]; symporter activity [GO:0015293]; monocarboxylic acid transport [GO:0015718]","lactate transmembrane transporter activity [GO:0015129]; monocarboxylic acid transmembrane transporter activity [GO:0008028]; symporter activity [GO:0015293]","GO:0005887; GO:0008028; GO:0015129; GO:0015293; GO:0015718; GO:0016021","K08180;","gga:395383;"
"8",687,865,1519,1011,816,879,92,622,519,931,724,673,127,82,319,102,134,254,"g25295","P57788",1.18e-40,"MOT4_CHICK","reviewed","Monocarboxylate transporter 4 (MCT 4) (Solute carrier family 16 member 3)","SLC16A3 MCT4","Gallus gallus (Chicken)",473,"monocarboxylic acid transport [GO:0015718]","integral component of membrane [GO:0016021]; integral component of plasma membrane [GO:0005887]","integral component of membrane [GO:0016021]; integral component of plasma membrane [GO:0005887]; lactate transmembrane transporter activity [GO:0015129]; monocarboxylic acid transmembrane transporter activity [GO:0008028]; symporter activity [GO:0015293]; monocarboxylic acid transport [GO:0015718]","lactate transmembrane transporter activity [GO:0015129]; monocarboxylic acid transmembrane transporter activity [GO:0008028]; symporter activity [GO:0015293]","GO:0005887; GO:0008028; GO:0015129; GO:0015293; GO:0015718; GO:0016021","K08180;","gga:395383;"
"9",51,52,83,64,40,30,105,92,126,80,107,86,133,77,87,52,133,57,"g25809","P50549",2.48e-66,"ETV1_HUMAN","reviewed","ETS translocation variant 1 (Ets-related protein 81)","ETV1 ER81","Homo sapiens (Human)",477,"axon guidance [GO:0007411]; cell differentiation [GO:0030154]; mechanosensory behavior [GO:0007638]; muscle organ development [GO:0007517]; peripheral nervous system neuron development [GO:0048935]; positive regulation of transcription by RNA polymerase II [GO:0045944]; regulation of transcription by RNA polymerase II [GO:0006357]; transcription by RNA polymerase II [GO:0006366]","nuclear chromatin [GO:0000790]; nucleus [GO:0005634]","nuclear chromatin [GO:0000790]; nucleus [GO:0005634]; DNA-binding transcription activator activity, RNA polymerase II-specific [GO:0001228]; DNA-binding transcription factor activity [GO:0003700]; DNA-binding transcription factor activity, RNA polymerase II-specific [GO:0000981]; RNA polymerase II cis-regulatory region sequence-specific DNA binding [GO:0000978]; axon guidance [GO:0007411]; cell differentiation [GO:0030154]; mechanosensory behavior [GO:0007638]; muscle organ development [GO:0007517]; peripheral nervous system neuron development [GO:0048935]; positive regulation of transcription by RNA polymerase II [GO:0045944]; regulation of transcription by RNA polymerase II [GO:0006357]; transcription by RNA polymerase II [GO:0006366]","DNA-binding transcription activator activity, RNA polymerase II-specific [GO:0001228]; DNA-binding transcription factor activity [GO:0003700]; DNA-binding transcription factor activity, RNA polymerase II-specific [GO:0000981]; RNA polymerase II cis-regulatory region sequence-specific DNA binding [GO:0000978]","GO:0000790; GO:0000978; GO:0000981; GO:0001228; GO:0003700; GO:0005634; GO:0006357; GO:0006366; GO:0007411; GO:0007517; GO:0007638; GO:0030154; GO:0045944; GO:0048935","K09431;","hsa:2115;"
"10",44,41,176,45,28,78,25,61,122,44,26,87,23,167,364,23,51,174,"g25830",NA,NA,NA,NA,NA,NA,NA,NA,NA,NA,NA,NA,NA,NA,NA
"11",21,10,43,42,11,25,24,150,110,71,120,133,85,57,62,49,88,101,"g25991",NA,NA,NA,NA,NA,NA,NA,NA,NA,NA,NA,NA,NA,NA,NA
"12",362,665,665,364,353,366,202,1023,748,513,788,588,873,1809,1967,470,920,1421,"g27090","Q9WU63",8.05e-41,"HEBP2_MOUSE","reviewed","Heme-binding protein 2 (Protein SOUL)","Hebp2 Soul","Mus musculus (Mouse)",205,"negative regulation of mitochondrial membrane potential [GO:0010917]; positive regulation of mitochondrial membrane permeability [GO:0035794]; positive regulation of necrotic cell death [GO:0010940]","cytoplasm [GO:0005737]; mitochondrion [GO:0005739]","cytoplasm [GO:0005737]; mitochondrion [GO:0005739]; heme binding [GO:0020037]; negative regulation of mitochondrial membrane potential [GO:0010917]; positive regulation of mitochondrial membrane permeability [GO:0035794]; positive regulation of necrotic cell death [GO:0010940]","heme binding [GO:0020037]","GO:0005737; GO:0005739; GO:0010917; GO:0010940; GO:0020037; GO:0035794","","mmu:56016;"
"13",913,248,815,224,203,245,59,104,147,75,162,37,45,50,97,18,42,35,"g27092","Q9Y5Z4",4.46e-27,"HEBP2_HUMAN","reviewed","Heme-binding protein 2 (Placental protein 23) (PP23) (Protein SOUL)","HEBP2 C6orf34 SOUL","Homo sapiens (Human)",205,"negative regulation of mitochondrial membrane potential [GO:0010917]; neutrophil degranulation [GO:0043312]; positive regulation of mitochondrial membrane permeability [GO:0035794]; positive regulation of necrotic cell death [GO:0010940]","azurophil granule lumen [GO:0035578]; cytoplasm [GO:0005737]; extracellular exosome [GO:0070062]; extracellular region [GO:0005576]; mitochondrion [GO:0005739]","azurophil granule lumen [GO:0035578]; cytoplasm [GO:0005737]; extracellular exosome [GO:0070062]; extracellular region [GO:0005576]; mitochondrion [GO:0005739]; heme binding [GO:0020037]; negative regulation of mitochondrial membrane potential [GO:0010917]; neutrophil degranulation [GO:0043312]; positive regulation of mitochondrial membrane permeability [GO:0035794]; positive regulation of necrotic cell death [GO:0010940]","heme binding [GO:0020037]","GO:0005576; GO:0005737; GO:0005739; GO:0010917; GO:0010940; GO:0020037; GO:0035578; GO:0035794; GO:0043312; GO:0070062","","hsa:23593;"
"14",22,18,8,8,12,23,18,22,13,7,16,14,22,0,0,7,8,0,"g27244","P24044",1.4e-51,"CALM_PLAFA","reviewed","Calmodulin (CaM)","","Plasmodium falciparum",149,"calcium-mediated signaling [GO:0019722]","","calcium ion binding [GO:0005509]; calcium-mediated signaling [GO:0019722]","calcium ion binding [GO:0005509]","GO:0005509; GO:0019722","",""
"15",204,210,329,209,154,88,52,468,211,283,242,174,2005,504,2257,193,652,593,"g27639","P12394",7.37e-134,"CP17A_CHICK","reviewed","Steroid 17-alpha-hydroxylase/17,20 lyase (EC 1.14.14.19) (EC 1.14.14.32) (17-alpha-hydroxyprogesterone aldolase) (CYPXVII) (Cytochrome P450 17A1) (Cytochrome P450-C17) (Cytochrome P450c17)","CYP17A1 CYP17","Gallus gallus (Chicken)",508,"hormone biosynthetic process [GO:0042446]; progesterone metabolic process [GO:0042448]; sex differentiation [GO:0007548]; steroid biosynthetic process [GO:0006694]; steroid metabolic process [GO:0008202]","membrane [GO:0016020]","membrane [GO:0016020]; 17-alpha-hydroxyprogesterone aldolase activity [GO:0047442]; heme binding [GO:0020037]; iron ion binding [GO:0005506]; steroid 17-alpha-monooxygenase activity [GO:0004508]; hormone biosynthetic process [GO:0042446]; progesterone metabolic process [GO:0042448]; sex differentiation [GO:0007548]; steroid biosynthetic process [GO:0006694]; steroid metabolic process [GO:0008202]","17-alpha-hydroxyprogesterone aldolase activity [GO:0047442]; heme binding [GO:0020037]; iron ion binding [GO:0005506]; steroid 17-alpha-monooxygenase activity [GO:0004508]","GO:0004508; GO:0005506; GO:0006694; GO:0007548; GO:0008202; GO:0016020; GO:0020037; GO:0042446; GO:0042448; GO:0047442","K00512;","gga:425056;"
"16",11,30,40,33,20,32,111,126,102,19,201,198,321,195,224,25,105,212,"g27780",NA,NA,NA,NA,NA,NA,NA,NA,NA,NA,NA,NA,NA,NA,NA
"17",1829,1589,4348,3307,1556,950,699,2809,3032,2206,1812,1219,530,419,1213,286,575,584,"g30027","Q6ZZY0",0,"CRY1_SYLBO","reviewed","Cryptochrome-1","CRY1","Sylvia borin (Garden warbler)",620,"circadian rhythm [GO:0007623]; negative regulation of gluconeogenesis [GO:0045721]; protein-chromophore linkage [GO:0018298]; response to light stimulus [GO:0009416]","cytosol [GO:0005829]; nucleus [GO:0005634]; photoreceptor disc membrane [GO:0097381]; photoreceptor outer segment membrane [GO:0042622]","cytosol [GO:0005829]; nucleus [GO:0005634]; photoreceptor disc membrane [GO:0097381]; photoreceptor outer segment membrane [GO:0042622]; nucleotide binding [GO:0000166]; photoreceptor activity [GO:0009881]; circadian rhythm [GO:0007623]; negative regulation of gluconeogenesis [GO:0045721]; protein-chromophore linkage [GO:0018298]; response to light stimulus [GO:0009416]","nucleotide binding [GO:0000166]; photoreceptor activity [GO:0009881]","GO:0000166; GO:0005634; GO:0005829; GO:0007623; GO:0009416; GO:0009881; GO:0018298; GO:0042622; GO:0045721; GO:0097381","",""
"18",1604,1184,2388,2491,1361,1776,419,1227,972,985,946,995,198,189,437,159,306,214,"g30029","Q49AN0",4.01e-117,"CRY2_HUMAN","reviewed","Cryptochrome-2","CRY2 KIAA0658","Homo sapiens (Human)",593,"blue light signaling pathway [GO:0009785]; circadian regulation of gene expression [GO:0032922]; circadian rhythm [GO:0007623]; entrainment of circadian clock by photoperiod [GO:0043153]; glucose homeostasis [GO:0042593]; negative regulation of circadian rhythm [GO:0042754]; negative regulation of glucocorticoid receptor signaling pathway [GO:2000323]; negative regulation of phosphoprotein phosphatase activity [GO:0032515]; negative regulation of transcription, DNA-templated [GO:0045892]; negative regulation of transcription by RNA polymerase II [GO:0000122]; protein-chromophore linkage [GO:0018298]; regulation of circadian rhythm [GO:0042752]; regulation of sodium-dependent phosphate transport [GO:2000118]; response to activity [GO:0014823]; response to light stimulus [GO:0009416]","cytosol [GO:0005829]; extracellular region [GO:0005576]; nuclear speck [GO:0016607]; nucleus [GO:0005634]","cytosol [GO:0005829]; extracellular region [GO:0005576]; nuclear speck [GO:0016607]; nucleus [GO:0005634]; blue light photoreceptor activity [GO:0009882]; damaged DNA binding [GO:0003684]; DNA binding [GO:0003677]; FAD binding [GO:0071949]; phosphatase binding [GO:0019902]; single-stranded DNA binding [GO:0003697]; transcription regulatory region sequence-specific DNA binding [GO:0000976]; blue light signaling pathway [GO:0009785]; circadian regulation of gene expression [GO:0032922]; circadian rhythm [GO:0007623]; entrainment of circadian clock by photoperiod [GO:0043153]; glucose homeostasis [GO:0042593]; negative regulation of circadian rhythm [GO:0042754]; negative regulation of glucocorticoid receptor signaling pathway [GO:2000323]; negative regulation of phosphoprotein phosphatase activity [GO:0032515]; negative regulation of transcription by RNA polymerase II [GO:0000122]; negative regulation of transcription, DNA-templated [GO:0045892]; protein-chromophore linkage [GO:0018298]; regulation of circadian rhythm [GO:0042752]; regulation of sodium-dependent phosphate transport [GO:2000118]; response to activity [GO:0014823]; response to light stimulus [GO:0009416]","blue light photoreceptor activity [GO:0009882]; damaged DNA binding [GO:0003684]; DNA binding [GO:0003677]; FAD binding [GO:0071949]; phosphatase binding [GO:0019902]; single-stranded DNA binding [GO:0003697]; transcription regulatory region sequence-specific DNA binding [GO:0000976]","GO:0000122; GO:0000976; GO:0003677; GO:0003684; GO:0003697; GO:0005576; GO:0005634; GO:0005829; GO:0007623; GO:0009416; GO:0009785; GO:0009882; GO:0014823; GO:0016607; GO:0018298; GO:0019902; GO:0032515; GO:0032922; GO:0042593; GO:0042752; GO:0042754; GO:0043153; GO:0045892; GO:0071949; GO:2000118; GO:2000323","K02295;","hsa:1408;"
"19",246,209,388,419,214,82,82,174,115,135,168,197,7,18,60,16,51,47,"g30030","Q32Q86",1.23e-65,"CRY1_RAT","reviewed","Cryptochrome-1","Cry1","Rattus norvegicus (Rat)",588,"circadian regulation of gene expression [GO:0032922]; circadian rhythm [GO:0007623]; DNA damage induced protein phosphorylation [GO:0006975]; entrainment of circadian clock by photoperiod [GO:0043153]; gluconeogenesis [GO:0006094]; glucose homeostasis [GO:0042593]; lipid storage [GO:0019915]; negative regulation of circadian rhythm [GO:0042754]; negative regulation of glucocorticoid receptor signaling pathway [GO:2000323]; negative regulation of glucocorticoid secretion [GO:2000850]; negative regulation of gluconeogenesis [GO:0045721]; negative regulation of G protein-coupled receptor signaling pathway [GO:0045744]; negative regulation of protein ubiquitination [GO:0031397]; negative regulation of transcription, DNA-templated [GO:0045892]; negative regulation of transcription by RNA polymerase II [GO:0000122]; positive regulation of protein ubiquitination [GO:0031398]; protein-chromophore linkage [GO:0018298]; regulation of circadian rhythm [GO:0042752]; regulation of DNA damage checkpoint [GO:2000001]; response to activity [GO:0014823]; response to glucagon [GO:0033762]; response to insulin [GO:0032868]; response to light stimulus [GO:0009416]","mitochondrion [GO:0005739]; nucleus [GO:0005634]","mitochondrion [GO:0005739]; nucleus [GO:0005634]; double-stranded DNA binding [GO:0003690]; E-box binding [GO:0070888]; histone deacetylase binding [GO:0042826]; kinase binding [GO:0019900]; nuclear hormone receptor binding [GO:0035257]; nucleotide binding [GO:0000166]; phosphatase binding [GO:0019902]; photoreceptor activity [GO:0009881]; protein kinase binding [GO:0019901]; transcription factor binding [GO:0008134]; circadian regulation of gene expression [GO:0032922]; circadian rhythm [GO:0007623]; DNA damage induced protein phosphorylation [GO:0006975]; entrainment of circadian clock by photoperiod [GO:0043153]; gluconeogenesis [GO:0006094]; glucose homeostasis [GO:0042593]; lipid storage [GO:0019915]; negative regulation of circadian rhythm [GO:0042754]; negative regulation of G protein-coupled receptor signaling pathway [GO:0045744]; negative regulation of glucocorticoid receptor signaling pathway [GO:2000323]; negative regulation of glucocorticoid secretion [GO:2000850]; negative regulation of gluconeogenesis [GO:0045721]; negative regulation of protein ubiquitination [GO:0031397]; negative regulation of transcription by RNA polymerase II [GO:0000122]; negative regulation of transcription, DNA-templated [GO:0045892]; positive regulation of protein ubiquitination [GO:0031398]; protein-chromophore linkage [GO:0018298]; regulation of circadian rhythm [GO:0042752]; regulation of DNA damage checkpoint [GO:2000001]; response to activity [GO:0014823]; response to glucagon [GO:0033762]; response to insulin [GO:0032868]; response to light stimulus [GO:0009416]","double-stranded DNA binding [GO:0003690]; E-box binding [GO:0070888]; histone deacetylase binding [GO:0042826]; kinase binding [GO:0019900]; nuclear hormone receptor binding [GO:0035257]; nucleotide binding [GO:0000166]; phosphatase binding [GO:0019902]; photoreceptor activity [GO:0009881]; protein kinase binding [GO:0019901]; transcription factor binding [GO:0008134]","GO:0000122; GO:0000166; GO:0003690; GO:0005634; GO:0005739; GO:0006094; GO:0006975; GO:0007623; GO:0008134; GO:0009416; GO:0009881; GO:0014823; GO:0018298; GO:0019900; GO:0019901; GO:0019902; GO:0019915; GO:0031397; GO:0031398; GO:0032868; GO:0032922; GO:0033762; GO:0035257; GO:0042593; GO:0042752; GO:0042754; GO:0042826; GO:0043153; GO:0045721; GO:0045744; GO:0045892; GO:0070888; GO:2000001; GO:2000323; GO:2000850","K02295;","rno:299691;"
"20",16,53,25,29,37,22,18,98,28,70,66,71,282,281,217,69,132,200,"g30156","Q29RZ5",7.36e-61,"TNG2_BOVIN","reviewed","Transport and Golgi organization protein 2 homolog","TANGO2","Bos taurus (Bovine)",276,"Golgi organization [GO:0007030]; protein secretion [GO:0009306]","Golgi apparatus [GO:0005794]","Golgi apparatus [GO:0005794]; Golgi organization [GO:0007030]; protein secretion [GO:0009306]","","GO:0005794; GO:0007030; GO:0009306","","bta:518209;"
"21",1289,1177,1883,1549,1122,1066,873,1588,1693,1159,1467,1242,1583,1430,2034,862,1819,1674,"g30299","Q2YDQ5",1.27e-77,"FBXL5_DANRE","reviewed","F-box/LRR-repeat protein 5 (F-box and leucine-rich repeat protein 5)","fbxl5","Danio rerio (Zebrafish) (Brachydanio rerio)",679,"iron ion homeostasis [GO:0055072]; protein ubiquitination [GO:0016567]; SCF-dependent proteasomal ubiquitin-dependent protein catabolic process [GO:0031146]; ubiquitin-dependent protein catabolic process [GO:0006511]","perinuclear region of cytoplasm [GO:0048471]; SCF ubiquitin ligase complex [GO:0019005]","perinuclear region of cytoplasm [GO:0048471]; SCF ubiquitin ligase complex [GO:0019005]; iron ion binding [GO:0005506]; iron ion homeostasis [GO:0055072]; protein ubiquitination [GO:0016567]; SCF-dependent proteasomal ubiquitin-dependent protein catabolic process [GO:0031146]; ubiquitin-dependent protein catabolic process [GO:0006511]","iron ion binding [GO:0005506]","GO:0005506; GO:0006511; GO:0016567; GO:0019005; GO:0031146; GO:0048471; GO:0055072","",""
"22",29,20,28,44,27,26,35,81,44,52,69,90,225,74,91,29,95,95,"g30473",NA,NA,NA,NA,NA,NA,NA,NA,NA,NA,NA,NA,NA,NA,NA
"23",145,98,217,196,131,104,81,192,136,154,178,164,76,74,151,30,76,68,"g30477",NA,NA,NA,NA,NA,NA,NA,NA,NA,NA,NA,NA,NA,NA,NA
"24",74,64,100,120,68,63,40,93,107,45,62,56,36,51,81,31,48,60,"g31031",NA,NA,NA,NA,NA,NA,NA,NA,NA,NA,NA,NA,NA,NA,NA
